{
  "$schema": "https://json-schema.org/draft/2020-12/schema",
  "$id": "https://flowstead.app/schema/flowsheet.schema.json",
  "title": "Flowstead flowsheet",
  "description": "The master copy of a Flowstead project (decision D5). Mirrors android/core app.flowstead.core.model.Flowsheet and engine Flowstead.Engine.Contracts.Flowsheet. All numbers SI.",
  "type": "object",
  "properties": {
    "schemaVersion": {
      "type": "integer",
      "const": 1
    },
    "propertyPackage": {
      "type": [
        "string",
        "null"
      ],
      "examples": [
        "Peng-Robinson (PR)"
      ]
    },
    "compounds": {
      "type": "array",
      "items": {
        "type": "string"
      },
      "uniqueItems": true
    },
    "atmosphericPressurePa": {
      "type": "number",
      "exclusiveMinimum": 0,
      "default": 101325,
      "description": "Reference for gauge pressures shown in this project"
    },
    "objects": {
      "type": "array",
      "items": {
        "$ref": "#/$defs/SimObject"
      }
    },
    "connections": {
      "type": "array",
      "items": {
        "$ref": "#/$defs/Connection"
      }
    },
    "reactions": {
      "type": "array",
      "description": "Reactions reactors can use; each reactor lists the ids it runs in refs.reactions (comma-separated).",
      "items": {
        "$ref": "#/$defs/Reaction"
      }
    },
    "hypotheticals": {
      "type": "array",
      "description": "User-defined pseudo-components (HYSYS hypotheticals); each name is also in compounds.",
      "items": { "$ref": "#/$defs/Hypothetical" }
    },
    "sizingCriteria": {
      "type": "object",
      "description": "App-only line-sizing limits by service (gas, liquid, twoPhase), each a set of optional Specs in SI: maxVelocity, minVelocity (m/s), maxMomentumFlux (kg/m·s²), maxFrictionGradient (Pa/m), maxMach, erosionalC (API RP 14E). Not part of the solved model; the engine ignores it."
    },
    "documentInfo": {
      "type": "object",
      "description": "App-only title block for every project document (data sheets, PFD, H&MB): company, project, projectNumber, client, site, preparedBy, checkedBy, approvedBy, pfdNumber, hmbNumber, revision (strings). Not part of the solved model; the engine ignores it."
    },
    "tables": {
      "type": "array",
      "description": "App-only property tables drawn on the flowsheet and the printed PFD: objectId, keys (result keys to show), dx and dy (offset from the object, world units). Not part of the solved model; the engine ignores it.",
      "items": {
        "type": "object",
        "required": ["objectId", "keys"],
        "properties": {
          "objectId": { "type": "string" },
          "keys": { "type": "array", "items": { "type": "string" } },
          "dx": { "type": "number" },
          "dy": { "type": "number" }
        }
      }
    }
  },
  "$defs": {
    "ObjectType": {
      "enum": [
        "material_stream",
        "energy_stream",
        "heater",
        "cooler",
        "heat_exchanger",
        "air_cooler",
        "pump",
        "compressor",
        "expander",
        "valve",
        "pipe_segment",
        "orifice_plate",
        "relief_valve",
        "mixer",
        "splitter",
        "component_splitter",
        "separator",
        "three_phase_separator",
        "tank",
        "filter",
        "solids_separator",
        "shortcut_column",
        "distillation_column",
        "absorber",
        "refluxed_absorber",
        "reboiled_absorber",
        "conversion_reactor",
        "equilibrium_reactor",
        "gibbs_reactor",
        "cstr",
        "pfr",
        "recycle",
        "adjust",
        "set",
        "energy_recycle"
      ]
    },
    "Spec": {
      "type": "object",
      "required": [
        "si",
        "unit"
      ],
      "properties": {
        "si": {
          "type": "number",
          "description": "Value in the SI base unit"
        },
        "unit": {
          "type": "string",
          "description": "Unit id the user typed it in (display only), e.g. barg"
        }
      }
    },
    "SimObject": {
      "type": "object",
      "required": [
        "id",
        "tag",
        "type"
      ],
      "properties": {
        "id": {
          "type": "string"
        },
        "tag": {
          "type": "string",
          "examples": [
            "V-100",
            "FEED"
          ]
        },
        "type": {
          "$ref": "#/$defs/ObjectType"
        },
        "x": {
          "type": "number"
        },
        "y": {
          "type": "number"
        },
        "specs": {
          "type": "object",
          "description": "User specifications (SI). Streams: temperature, pressure, vapourFraction, massEnthalpy, molarFlow, massFlow. Valve: outletPressure | pressureDrop. Heater/cooler: outletTemperature | duty, pressureDrop. Pump: outletPressure | pressureRise, efficiency. Compressor: outletPressure | pressureRise | pressureRatio, efficiency. Expander: outletPressure | pressureDrop | pressureRatio, efficiency. Heat exchanger: duty | hotOutletTemperature | coldOutletTemperature, hotPressureDrop, coldPressureDrop. Splitter: split1, split2. Pipe segment: length, innerDiameter, outerDiameter, elevationChange, roughness, increments, heatTransferCoefficient + ambientTemperature. Orifice plate: orificeDiameter, pipeDiameter. Adjust: target, tolerance, minimum, maximum.",
          "additionalProperties": {
            "$ref": "#/$defs/Spec"
          }
        },
        "composition": {
          "type": "object",
          "description": "Overall mole fractions by compound (material streams); must sum to 1",
          "additionalProperties": {
            "type": "number",
            "minimum": 0,
            "maximum": 1
          }
        },
        "refs": {
          "type": "object",
          "description": "References to other objects. Adjust: manipulatedObject, manipulatedSpec (a spec key on that object), controlledObject, controlledProperty (a result key). Its specs: target, optional tolerance, minimum, maximum (SI). Method choices: pipe segment correlation (beggs_brill | lockhart_martinelli | petalas_aziz), orifice plate taps (flange | corner | radius). App-only (ignored by the engine): pipe nps, schedule, service (gas | liquid | two_phase).",
          "additionalProperties": {
            "type": "string"
          }
        },
        "sheet": {
          "type": "object",
          "description": "App-only data-sheet fields (free text): documentNumber, revision, revisionDescription, service, notes, designPressure, designTemperature, material, corrosionAllowance, insulation, codes. Not part of the solved model; the engine ignores it.",
          "additionalProperties": {
            "type": "string"
          }
        }
      }
    },
    "Connection": {
      "type": "object",
      "required": [
        "fromObject",
        "fromPort",
        "toObject",
        "toPort"
      ],
      "properties": {
        "fromObject": {
          "type": "string"
        },
        "fromPort": {
          "type": "integer",
          "minimum": 0
        },
        "toObject": {
          "type": "string"
        },
        "toPort": {
          "type": "integer",
          "minimum": 0
        }
      }
    },
    "Hypothetical": {
      "type": "object",
      "required": ["name"],
      "description": "Give normalBoilingPoint (K) or molecularWeight, optionally specificGravity (60 °F/60 °F); DWSIM's correlations estimate the rest. criticalTemperature (K), criticalPressure (Pa) and acentricFactor override the estimates.",
      "properties": {
        "name": { "type": "string", "minLength": 1 },
        "normalBoilingPoint": { "type": "number" },
        "molecularWeight": { "type": "number" },
        "specificGravity": { "type": "number" },
        "criticalTemperature": { "type": "number" },
        "criticalPressure": { "type": "number" },
        "acentricFactor": { "type": "number" }
      }
    },
    "Reaction": {
      "type": "object",
      "required": [
        "id",
        "name",
        "type",
        "stoichiometry",
        "baseCompound"
      ],
      "properties": {
        "id": {
          "type": "string"
        },
        "name": {
          "type": "string"
        },
        "type": {
          "enum": [
            "conversion",
            "equilibrium",
            "kinetic"
          ]
        },
        "stoichiometry": {
          "type": "object",
          "description": "Coefficient by compound; negative for reactants",
          "additionalProperties": {
            "type": "number"
          }
        },
        "baseCompound": {
          "type": "string",
          "description": "A reactant (negative coefficient)"
        },
        "phase": {
          "enum": [
            "mixture",
            "vapour",
            "liquid"
          ],
          "default": "mixture",
          "description": "Equilibrium reactions: vapour or liquid only"
        },
        "conversion": {
          "type": "number",
          "exclusiveMinimum": 0,
          "maximum": 1,
          "description": "Conversion reactions: fraction of the base compound converted"
        },
        "approachTemperature": {
          "type": "number",
          "description": "Equilibrium reactions: K (temperature difference) added to T when evaluating K"
        },
        "forwardOrders": {
          "type": "object",
          "additionalProperties": {
            "type": "number"
          }
        },
        "reverseOrders": {
          "type": "object",
          "additionalProperties": {
            "type": "number"
          }
        },
        "forwardA": {
          "type": "number",
          "description": "Kinetic: pre-exponential factor; rate in mol/(m³·s), concentrations in mol/m³"
        },
        "forwardE": {
          "type": "number",
          "description": "Kinetic: activation energy, J/mol"
        },
        "reverseA": {
          "type": "number"
        },
        "reverseE": {
          "type": "number"
        }
      }
    }
  }
}
